Question,Answer,Topic
What is the discount rate for Onsite Credit Card (Visa or Mastercard)?,A 3% discount on tuition fees is granted.,31
What is the discount rate for Onsite Debit Card?,A 3.5% discount on tuition fees is granted.,31
Who can I contact for verification and necessary computations for the Full Payment Discount?,You can contact the Accounting Office for verification and the necessary computations.,31
What is the purpose of contacting the Accounting Office?,For verification and the necessary computations.,31
Are there any other discounts available aside from Family and Sibling Discount and Full Payment Discount?,"No, the two fee discounts available for students during enrollment are Family and Sibling Discount and Full Payment Discount.",31
Can I apply for both Family and Sibling Discount and Full Payment Discount?,The text does not specify if a student can apply for both discounts.,31
Can I apply for the Family and Sibling Discount if I have no siblings enrolled in USC?,"No, Family and Sibling Discount is available for siblings enrolled in USC.",31
"Can I apply for the Family and Sibling Discount if my sibling is enrolled in Montessori, Law, or Graduate Programs?","No, a student may enjoy a 5% discount on tuition fees except for the sibling/s enrolled in Montessori, Law, and Graduate Programs.",31
How do I know if my application for Family and Sibling Discount is approved?,The application is then forwarded to VP Finance for approval whose status can be monitored.,31
Can I pay for my enrolled courses in full and still apply for the Family and Sibling Discount?,The text does not specify if a student can apply for both discounts.,31
Are there any other requirements needed to apply for the Full Payment Discount?,"No, the text does not specify any other requirements needed to apply for the Full Payment Discount.",31
Can I pay for my enrolled courses in full and still apply for other discounts?,The text does not specify if a student can apply for other discounts aside from the Full Payment Discount.,31
Who can I contact if I have questions about the fee discounts?,The text does not specify who to contact for general inquiries about the fee discounts.,31
Are the discount rates applicable to all students?,The text does not specify if the discount rates are applicable to all students.,31
Can I apply for the Full Payment Discount if I'm not paying for my enrolled courses in full?,"No, Full Payment Discount is available for a student who wishes to pay for his or her enrolled courses in full.",31
Are there any deadlines for applying for the fee discounts?,The text does not specify any deadlines for applying for the fee discounts.,31
Can I apply for the fee discounts online?,The text does not specify if the application for fee discounts can be done online.,31
Are the fee discounts applicable to all programs?,"No, a student may enjoy a 5% discount on tuition fees except for the sibling/s enrolled in Montessori, Law, and Graduate Programs.",31
What does a student who wants to transfer out of USC need?,Specific documents which may be required by the university to where he/she will transfer to.,32
How can a student apply for a Certificate of Transfer Credential and an evaluation or informative copy of the Transcript of Records (TOR)?,"By clicking the ""Online request for school records"" at the log in page of the ISMIS portal.",32
Where can a student apply for a Certificate of Good Moral Character?,At the Office of Student Formation and Activities office.,32
Who will check on a student's records for a Certificate of Good Moral Character?,The Student Discipline Officer.,32
What is the next step if a student has no pending cases for a Certificate of Good Moral Character?,Proceed to the cashier to pay for the fee for the certificate.,32
What should a student bring back to the Office of Student Formation and Activities after paying for the Certificate of Good Moral Character?,The receipt.,32
Where can a student claim their Certificate of Good Moral Character?,At the Office of Student Formation and Activities.,32
What is required to transfer out of USC?,Specific documents which may be required by the university to where he/she will transfer to.,32
How does a student request for school records online?,"By clicking the ""Online request for school records"" at the log in page of the ISMIS portal.",32
"What is the purpose of the ""Online request for school records""?",To apply for a Certificate of Transfer Credential and an evaluation or informative copy of the Transcript of Records (TOR).,32
"Where is the ""Online request for school records"" located?",At the log in page of the ISMIS portal.,32
What is the role of the Student Discipline Officer in the Certificate of Good Moral Character process?,To check on a student's records.,32
What is the next step after the Student Discipline Officer checks on a student's records?,Proceed to the cashier to pay for the fee for the certificate.,32
How much does a Certificate of Good Moral Character cost?,The fee for the certificate.,32
Where does a student pay for the Certificate of Good Moral Character?,At the cashier.,32
What is the purpose of paying for the Certificate of Good Moral Character?,To obtain the certificate.,32
What is the final step in obtaining a Certificate of Good Moral Character?,Claiming the certificate at the Office of Student Formation and Activities.,32
What is required to claim a Certificate of Good Moral Character?,The receipt.,32
Where is the Office of Student Formation and Activities located?,Not specified in the context.,32
What is the purpose of the Office of Student Formation and Activities?,To process the Certificate of Good Moral Character.,32
Who issues the Certificate of Good Moral Character?,The Office of Student Formation and Activities.,32
What is the Certificate of Good Moral Character used for?,Not specified in the context.,32
Can a student apply for a Certificate of Good Moral Character online?,"No, at the Office of Student Formation and Activities office.",32
How long does it take to process a Certificate of Good Moral Character?,Not specified in the context.,32
Are there any requirements for a student to apply for a Certificate of Good Moral Character?,No pending cases.,32
What happens if a student has pending cases for a Certificate of Good Moral Character?,Not specified in the context.,32
Can a student apply for a Certificate of Good Moral Character if they have pending cases?,No.,32
What is the difference between a Certificate of Transfer Credential and a Certificate of Good Moral Character?,Not specified in the context.,32
Can a student apply for both a Certificate of Transfer Credential and a Certificate of Good Moral Character?,Yes.,32
Are there any fees associated with applying for a Certificate of Transfer Credential?,Not specified in the context.,32
Are there any fees associated with applying for a Certificate of Good Moral Character?,"Yes, the fee for the certificate.",32
What is the email convention for students at USC?,idnumber@usc.edu.ph (e.g. 12345@usc.edu.ph),33
What is the default password for students at USC?,lastname + your idnumber (e.g. delacruz12345),33
What should you do after logging in to your USC email account?,Create a recovery email so that you can reset your password anytime in case you forget.,33
Why does Gmail ask you to change your password?,"(No explicit answer in the text, but implied that it's a security measure)",33
How do you set up a recovery email in your Google account?,"Step 1: Go to ""Manage your Google account"". Step 2: Personal Info. Step 3: Contact Info. Step 4: Recovery Email.",33
What is the official Learning Management System (LMS) for University of San Carlos?,Canvas,33
How do you set your password and access the Canvas Learning Management System Portal?,"Follow the steps: 1. Go to https://usc.instructure.com. 2. Click the ""Forgot Password"" link. 3. Provide your USC email address. 4. Click the ""Request Password"" button. 5. Check your USC email for the reset password link sent by Canvas. 6. Click the Reset Password link in the email and set your preferred password. 7. Login to Canvas at https://usc.instructure.com.",33
What is the username to login to Canvas?,Your USC email address,33
Where are your enrolled courses displayed in Canvas?,On the dashboard,33
What should you do if you don't see the reset password email from Canvas?,Check the Spam box as well since there are instances where the email from Canvas is saved in the Spam box.,33
What is the purpose of setting up a recovery email?,So that you can reset your password anytime in case you forget.,33
What is the URL to access the Canvas Learning Management System Portal?,https://usc.instructure.com,33
What is the format of the USC email address?,idnumber@usc.edu.ph,33
What is the default password format for students at USC?,lastname + your idnumber (e.g. delacruz12345),33
What is the purpose of using the official USC Google account?,To use it responsibly and in accordance with Google Workspace for Education Terms of Service.,33
Where can you find the Google Workspace for Education Terms of Service?,https://gsuite.google.com/terms/education_terms.html,33
What should you do after setting up your recovery email?,"(No explicit answer in the text, but implied that you should proceed with using your USC email account)",33
What is the benefit of setting up a recovery email?,You can reset your password anytime in case you forget.,33
How do you request a password reset in Canvas?,"Click the ""Forgot Password"" link and provide your USC email address.",33
"What happens after you click the ""Request Password"" button in Canvas?",You will receive a reset password link sent by Canvas to your USC email.,33
What should you do if you forget your password?,Use the recovery email to reset your password.,33
What is the purpose of using Canvas at USC?,"(No explicit answer in the text, but implied that it's for learning and academic purposes)",33
How do you access your enrolled courses in Canvas?,They are displayed on the dashboard.,33
What is the importance of using the official USC Google account responsibly?,It should be used in accordance with Google Workspace for Education Terms of Service.,33
What is the relationship between the USC email address and the Canvas login?,The USC email address is used as the username to login to Canvas.,33
What is the benefit of using the official USC Google account?,"(No explicit answer in the text, but implied that it provides a secure and organized way to manage academic activities)",33
What is expected of a student once they are enrolled?,To settle the full tuition and other school fees within the term.,34
What does the term refer to?,A semester or summer a student is enrolled in.,34
Can tuition and other school fees be paid in full at the time of enrollment?,Yes.,34
Can tuition and other school fees be paid by installment?,"Yes, with an amount set by the Office of Finance.",34
Can full tuition and other school fees be paid without prejudice to any additional assessment that may be applied during the term?,Yes.,34
Where can students pay their fees?,"At the cashier located at the ground floor of Bunzel building, or through online means.",34
Are there discounts granted on full payment of school fees within a specified period?,Yes.,34
Who sets the specified period for discounts?,The Office of Finance.,34
How do students avail of the discount?,By applying at the Accounting Office within a specified time during the enrollment period.,34
What happens if a student fails to apply for the discount within the specified time?,The privilege will be forfeited.,34
Can students pay their tuition and other fees on an installment basis?,"Yes, provided that the down payment is made at enrollment according to the amount fixed by the University.",34
How often must the balance be paid?,Monthly or on scheduled examination dates.,34
Where can teachers view the payment status of students?,On the class lists in ISMIS.,34
How much is the non-refundable fee for a student who withdraws their enrollment within the enrollment period?,P500.00.,34
What is the charge for a student who withdraws their enrollment within the first week of classes during a regular semester or within the first to third day of classes during a summer term?,Matriculation fee plus 10% of the remaining total school fees.,34
What is the charge for a student who withdraws their enrollment within the second week of classes during a regular semester or within the fourth to sixth day of classes during a summer term?,Matriculation fee plus 20% of the remaining total school fees.,34
What is the charge for a student who withdraws their enrollment after the second week of classes during a regular semester or from the seventh day of classes onwards during a summer term?,100% of the total school fees.,34
"What happens to the amount paid if a student withdraws during the enrollment period, but prior to the opening of classes?",A refund of the amount paid (less processing charges and less non-refundable matriculation fees) shall be made.,34
Who are granted a five (5%) percent discount each on tuition fees only?,"Members of the same family, that is, brothers and sisters, enrolled during the regular academic year/semester in any of the basic education departments and/or undergraduate colleges of the University.",34
Which programs are excluded from the family discount?,"Montessori, Law, and Graduate programs.",34
How many students can avail of the family discount?,Up to four (4) students.,34
Where can application forms for fee adjustment for children of University employees and members of the same family be found?,At the Office of the Vice President for Finance.,34
What determines the curricular year of a student?,The number of units earned in the curriculum of his/her program.,35
What is the condition for a student to be considered full-time?,If he/she carries a regular load prescribed in his/her curriculum for a given time.,35
Can a course be taken ahead of its prerequisite?,"No, otherwise, it shall be nullified and taken again even if the student is graduating.",35
What should laboratory courses be taken with?,The corresponding lecture courses in the same semester.,35
What happens if a student withdraws from a co-requisite course?,Both courses should be withdrawn together.,35
Can a failed co-requisite course be re-enrolled without re-enrolling the other course the student has passed?,Yes.,35
"Do curricular policies, including the sequence of courses, apply to transferees and shiftees?",Yes.,35
Can transferees and shiftees be given preference for override of prerequisites and opening of off-semester courses?,No.,35
What should the Chair inform the students of upon admission?,"The number of courses that they can enroll in, especially if some courses need prerequisites.",35
What is the option for an off-semester course?,A tutorial or petition may be provided.,35
Can regular students join an off-semester course in advance?,No.,35
What is the condition for a student to have an overload of not more than six (6) units in excess of the regular load?,If he/she is graduating at the end of the year; has not incurred more than five (5) failures (a grade of 5.0) in those terms that he/she was enrolled at the university; and has a grade point average (GPA) of at least 2.8.,35
What is the condition for repeated courses due to failures to be taken as overload?,"If recommended by the Department Chair and the School Dean, and approved by the Vice President for Academic Affairs (VPAA).",35
What is simultaneous enrollment?,A student may be allowed to enroll in the pre-requisite course and the advanced course simultaneously in order to graduate during his/her final term.,35
What is the restriction for simultaneous enrollment?,It is restricted to only a particular two-subject load.,35
What happens if a student fails in the prerequisite course?,He/she would have to retake all the advanced courses affected and the enrollment for the advanced courses automatically becomes null and void.,35
When can simultaneous enrollment of an advanced major course with a failed prerequisite course be allowed?,Starting on the third year of a four-year program and on the fourth year of a five-year program.,35
What are the conditions for petitioned/tutorial courses?,It is an off-semester course; it is a prerequisite course for the next semester offering; it is the only course left for the students to graduate at the end of the term; and there should be at least six (6) students for the petitioned course and five (5) students or less for the tutorial course.,35
Can a laboratory course be requested as a petitioned course?,Yes.,35
What is the override rule due to an INC grade of a prerequisite course in favor of an advanced course?,It may be allowed in the last academic year prior to graduation.,35
What is the basis for accreditation of courses?,Equivalence in course content and level of instruction.,35
What is the limit for units earned in non-degree programs that may be considered for accreditation to a degree program?,Fifty percent (50%) of the total required academic units of the degree program for graduation.,35
What is the condition for General Education Courses to be accredited?,A final grade of 2.5 (B- = 80%) or higher if taken from PAASCU-accredited degree programs and a final grade of 2.0 (B+ = 85%) or higher if taken from non-PAASCU accredited degree programs.,35
What is the basis for validating examinations?,The course description and official copy of the transcript of records (TOR) duly signed by the school registrar.,35
What happens if the records upon which the approval is based are later found to be incorrect?,The approved accreditation of courses is subject to revocation.,35
What is the residency requirement?,The student is expected to complete the program within the period specified in the program.,35
What is the Maximum Allowable Residency (MAR)?,Equal to the required number of years to complete the course multiplied by 1.5.,35
What is the effect of not filing a leave of absence?,The period covered by the student’s absence shall continue to be counted towards his/her Maximum Allowable Residency (MAR).,35
What happens if a new curriculum is implemented during the absence?,The student shall be required to follow the new curriculum on his/her return.,35
What is the effect on the student’s readmission?,It shall be subject to terms and conditions as may be imposed by the Department/School.,35
Can a student who does not file a leave of absence graduate with honors?,No.,35
How many official general examinations are required to be given every term?,Four (4).,35
What are the names of the official general examinations?,"Pre-midterm, mid-term, pre-final, and final examinations.",35
Where are the dates for these examinations posted?,On USC’s official website.,35
What should students do with their grades?,"Check their grades through their ISMIS account, print the grades, and keep a copy in a folder together with other important documents ready for reference on occasions such as advising, enrollment, graduation, and other activities when evidence of academic performance is needed.",35
What is the purpose of General Education in the curriculum?,This is the portion of the curriculum common to all undergraduate students regardless of their major.,36
What does General Education expose students to?,Various domains of knowledge and ways of comprehending social and natural realities.,36
What is the outcome of General Education on students?,Developing in the process their intellectual and civic competencies.,36
How many units of core courses are required in General Education?,24 units.,36
How many units of elective courses are required in General Education?,9 units.,36
How many units of the life and works of Rizal are required in General Education?,3 units.,36
What is the purpose of Education with a Mission (EDM) courses?,Facilitates understanding and prepares them to assume their role: Witness to the Word.,36
How many units of Education with a Mission (EDM) courses are required?,Six (6) units.,36
Who are required to take Education with a Mission (EDM) courses?,"All students, regardless of nationality, race, religion, culture, beliefs.",36
How many units of Physical Education (TPE) are required?,Eight (8) units.,36
When should students complete their Physical Education (TPE) requirements?,During their first two (2) years.,36
Can students enroll in two (2) or more TPE courses in a particular term?,No.,36
Are TPE units included in the summation of the total study load for the term?,Yes.,36
Are TPE units included in the computation of the grade point average (GPA)?,Yes.,36
Who may take adapted TPE classes?,Students with particular medical conditions or disabilities.,36
Who should students consult with to take adapted TPE classes?,The Department of Physical Education.,36
What is the National Service Training Program (NSTP) about?,"All incoming freshmen students, male and female, starting school year 2002-2003, enrolled in any baccalaureate program and in at least 2-year technical and vocational or associate course, are required to complete one NSTP component of their choice, as a graduation requirement.",36
What are the components of the National Service Training Program (NSTP)?,"Reserve Officers Training Corps (ROTC), Literacy Training Service (LTS), and Civic Welfare Training Service (CWTS).",36
How long does each component of the National Service Training Program (NSTP) last?,An academic period of two (2) semesters.,36
How many units are credited for each component of the National Service Training Program (NSTP)?,Three (3) units.,36
How many training hours are required for each component of the National Service Training Program (NSTP)?,54 to 90 training hours each semester.,36
Are international students required to enroll in the National Service Training Program (NSTP)?,No.,36
Why are international students exempted from taking the National Service Training Program (NSTP)?,No reason is stated in the text.,36
What happens to a student who incurs unexcused absences of more than 20% of the prescribed number of class hours or laboratory periods during the term?,Should be given NC or 5.0.,37
What happens if a student fails in one-third of the units in which he/she is enrolled?,He/she should not re-enroll in the same program without approval from the School Dean and the endorsement of the Department Chair.,37
What happens if a student fails the second time?,He/she may enroll in another program if accepted by the Department Chair concerned.,37
What happens if a student fails the third time?,He/she is disqualified from the University.,37
Is disqualification from the program applicable to the third-year level of a four-year program and to the fourth-year level of a five-year program?,"No, it no longer applies.",37
Can each department have its own retention policy?,"Yes, with the approval of the Vice President for Academic Affairs.",37
What is the grading system adopted by the University?,"1.0 is equivalent to 100-95%, 1.1 is equivalent to 94%, and so on.",37
What is the equivalent of a grade of 1.0?,Letter grade A+.,37
What is the equivalent of a grade of 1.1 to 1.3?,Letter grade A.,37
What is the equivalent of a grade of 1.4 to 1.7?,Letter grade A-.,37
What is the equivalent of a grade of 1.7 to 1.9?,Letter grade B+.,37
What is the equivalent of a grade of 2.0 to 2.2?,Letter grade B.,37
What is the equivalent of a grade of 2.3 to 2.5?,Letter grade B-.,37
What is the equivalent of a grade of 2.6-2.8?,Letter grade C+.,37
What is the equivalent of a grade of 2.9 to 3.0?,Letter grade C.,37
What is the equivalent of a grade of 5.0?,Letter grade C-.,37
What is a passing grade?,A grade within 1.0 and 3.0.,37
What happens if a student gets a 5.0 or NC?,It means that he or she has failed the course and therefore needed to retake in the succeeding semester until he or she passes the subject.,37
What does INC mean?,"Incomplete, a grade which indicates that the student has an initial passing grade but has not complied with all the academic requirements or failed to take the final examination for the course due to sickness, emergency cases, or accident.",37
What is the time limit to complete an INC grade?,Within a reasonable period set by the faculty member but not to exceed six (6) months following the semester or summer in which the course was taken.,37
What happens if the INC grade is not completed within the time limit?,"The grade automatically becomes ""NC"" (No Credit).",37
What does NC mean?,"No credit, a Final grade which does not earn credit nor indicate failure given in those cases where the student did not take the final examination in the course and did not inform the teacher of the reason for failing to take the final examination before the deadline for submission of grades in ISMIS, and his/her performance was not satisfactory to merit a passing grade.",37
What does W mean?,Withdrawal of enrollment from course/s with official notice.,37
What does IP mean?,"In Progress, a grade given to students who are still working on their thesis for a maximum of one (1) year.",37
How is the Grade Point Average (GPA) computed?,By multiplying the number of units assigned to a course by the final grade earned and then by dividing the summation of the products by the total number of units enrolled for the term.,37
Are grades of 5.0 and NC included in the GPA calculation?,Yes.,37
Is the GPA of NSTP included in the computation?,No.,37
What is the Dean’s Honors List?,A recognition of superior scholastic achievement through the Dean’s Honors List per semester of each School/Department.,37
What are the qualifications for the Dean’s Honors List?,"A regular load for the semester according to the curriculum enrolled, a Grade Point Average (GPA) of at least 1.70, and of good moral character and has not been found guilty of any offenses.",37
