Question,Answer,Topic
"What should be done after clicking the ""Check Status of Submitted Application"" button?",Complete the required fields and click the Search Applicant button.,11
How do you upload additional documents in ISMIS?,"Click on the ""Files Uploaded"" button or icon.",11
What is the purpose of the Concept Paper?,To elicit the applicant’s ideas on the possible research topic that he or she will pursue when he or she is admitted to the program.,11
Who evaluates the Concept Paper?,The Department Chair or Graduate Program Coordinator.,11
What happens to the Concept Paper during the interview?,It will be validated during the interview with the Chair/Graduate Program Coordinator for Master Programs or a Panel of Interviewers for Doctoral Programs.,11
What do students applying for Research Track Programs undergo?,A pre-admission process whereby he or she will prepare a research proposal.,11
What happens to the research proposal?,The applicant will pitch his or her proposal to a prospect adviser from among the identified experts or existing research groups of the department or school for acceptance.,11
What happens to the accepted research proposal?,It will be endorsed by the adviser to the committee for validation during the panel interview.,11
Can additional requirements be added by the department?,"Yes, depending upon the program applied for, such as proof of funding or financial support for those who will enroll in the research track.",11
What is the topic of this section of the student manual?,Topic 12: Admission Steps for Juris Doctor,12
What are the initial requirements for Juris Doctor applicants?,"Transcript of Records (TOR) with remarks of graduation, Certificate of Transfer Credentials/Honorable Dismissal (for Non-USC graduates), Certificate of Good Moral Character (for Non-USC graduates), and Personal Statement.",12
What is the purpose of the Personal Statement?,To enable the Dean’s Office to get to know the applicant and assess his or her readiness to enroll in the law program.,12
How many words should the Personal Statement not exceed?,"1,000 words",12
Where can the Personal Statement template be downloaded?,https://ismis.usc.edu.ph/Apply/DownloadPersonalStatementTemplate,12
In what format should the Personal Statement be submitted?,Microsoft Word format,12
What should be indicated in the Personal Statement?,The applicant’s desired law program with or without thesis,12
What should accompany the Personal Statement?,A Statement of Originality and Sole Authorship,12
What is the Statement of Originality and Sole Authorship?,The applicant’s solemn attestation to the Dean’s Office that the Personal Statement is his or her own work,12
Can the Statement of Originality and Sole Authorship be included in the word count?,No,12
What is the optional submission in addition to the Personal Statement?,"An academic essay of not more than 1,000 words on how he or she responded to the Covid-19 pandemic, or a 90-second video on any topic the applicant may wish to expound on.",12
Who are considered transferees?,Applicants who are USC graduates but have transferred to another higher education institution prior to applying for the JD program,12
What requirements must transferees submit?,Requirements 2 and 3,12
How do applicants apply for admission online in the ISMIS portal?,"By following the steps: Go to https://ismis.usc.edu.ph, click ""Applicants for Admission Graduate, Tertiary & Senior High School"", click the ""Submit Admission Application tab"", fill out the Personal Data Sheet, attach the required documents one by one, complete the Captcha, and click the Submit button.",12
What is the alternative tab for previous USC students and those who were already issued a Student ID in the past?,"""Submit Admission Application for 2nd Courser and Continuing Students""",12
"What is the alternative tab for International Passport Holders, Dual Citizens, or Filipino Graduates Abroad?","""International Applicants""",12
How do applicants check the application status and upload additional documents in ISMIS?,"By following the steps: Go to https://ismis.usc.edu.ph, click ""Applicants for Admission Graduate, Tertiary & Senior High School"", click the ""Check Status of Submitted Application"" button, complete the required fields, click the Search Applicant button, and click the ""Files Uploaded"" button or icon to add more documents.",12
What is the purpose of the Captcha?,Not specified in the context,12
Can applicants submit additional documents?,Yes,12
How do applicants upload additional documents?,"By clicking the ""Files Uploaded"" button or icon",12
"How much is the College Admission Examination (CAE) fee for BS Architecture, BS Landscape Architecture, and BS Interior Design?",P600.00,13
How much is the College Admission Examination (CAE) fee for the rest of the tertiary programs?,P500.00,13
What are the two ways to pay the College Admission Examination (CAE) Fees online?,PayMaya and DragonPay,13
What happens to payments made using PayMaya?,Payments made using this channel are posted real-time.,13
What is the link to access the payment module of ISMIS for PayMaya?,https://ismis.usc.edu.ph/Paymaya/firstindex,13
What information should be provided when paying using PayMaya?,The needed applicant information. Name should be consistent with ISMIS including the space in between the First Name.,13
What should be chosen under Payment Item when paying using PayMaya?,"Testing Fees, and kindly type the amount depending on the program applied.",13
What happens after submitting payment details using PayMaya?,It will generate an e-receipt.,13
How long does it take for DragonPay payments to be posted?,Normally it will take 2 to 3 banking days.,13
What is the link to access the payment module of ISMIS for DragonPay?,https://ismis.usc.edu.ph/Paymaya/firstindex,13
What information should be provided when paying using DragonPay?,The needed applicant information. Name should be consistent with ISMIS including the space in between the First Name.,13
What should be chosen under Payment Item when paying using DragonPay?,"Testing Fees, and kindly type the amount depending on the program applied.",13
What happens after proceeding to check out using DragonPay?,It will route the applicant to the Dragonpay Website.,13
What should be done after receiving the Reference Code and payment instructions via email for DragonPay?,Follow the Reference Code and the payment instructions sent to your email.,13
Who should be contacted for concerns regarding the process or status of offsite payments?,offsitecol@usc.edu.ph,13
How can applicants pay in-campus?,Via the USC Teller.,13
What should be shown to the USC Teller when paying in-campus?,The ISMIS notification on how to pay the College Admission Examinations.,13
What should be done after paying the testing fee?,Proceed to the Office of the Recruitment and Admissions (ORA) at the Downtown Campus and show the receipt or email the receipt to admissions-apply@usc.edu.ph.,13
What will the applicant receive after paying the testing fee?,A google form link where the applicant can choose a schedule of their College Admission Examination.,13
"Who should be contacted for concerns on the requirements, guidelines, and process?",offsitecol@usc.edu.ph or call (032) 401-2300 local 173 or (032) 2300-100 local 173 or call or text the Treasury Office at +639088866790.,13
What is the next step after admission requirements are verified?,The applicant will receive an email instruction from ISMIS on how to pay the testing fee online via payment centers or offline at the USC Teller.,13
What happens after payment is received?,The applicant will receive a Google Form link to schedule the College Admission Examination.,13
What is generated after the applicant has chosen the date for the College Admission Examination?,An Examination Permit.,13
What should the applicant present on the day of their scheduled examination?,A printed copy of the examination permit.,13
What is the purpose of the examination permit?,"It will serve as their entry pass to the Testing Center, USC Downtown Campus.",13
When will the examination results be available?,2 days from the examination date.,13
What happens after the examination results are available?,The Office of the Recruitment and Admissions will now endorse the applicant to the Department Chair for review and acceptance.,13
What happens if the Department Chair accepts the examination results?,The enrollment process will commence at this stage.,13
What happens if the applicant is advised to take another program?,"The applicant will be redirected to the Testing Center, USC Downtown Campus if there is any additional test to be taken and then to the Office of the Recruitment and Admissions for re-endorsement of the application to the Department Chair.",13
What documents do newly accepted applicants need to prepare after admission before proceeding to enrollment?,"For senior high school graduates or new first years, they should bring the following requirements upon enrollment and submit to the Office of the Registrar: Original Form 138 (Senior High School Card - Grade 12) duly signed/certified by the Principal/School Registrar as eligible for college, or the ALS A&E Certificate of Rating and other eligibility documents recognized by DepEd and CHED. Original Copy of Birth Certificate from National Statistics Office (NSO)/Philippine Statistics Authority (PSA), 1 copy 2x2 colored photo with white background, Accomplished Student’s Personal Data Sheet (online through ISMIS).",14
What are the requirements for transferees upon enrollment?,"For transferees, they should bring the following requirements upon enrollment and submit to the Office of the Registrar: Certificate of Transfer Credentials (Honorable Dismissal), Informative Copy of Transcript of Records (TOR), Original Copy of Birth Certificate from National Statistics Office (NSO)/Philippine Statistics Authority (PSA), 1 copy 2x2 colored photo with white background, Accomplished Course Accreditation Form (through ISMIS), Clearance from the Office of Student Formation and Activities (OSFA), Accomplished Student’s Personal Data Sheet (through ISMIS), Other requirements where applicable.",14
Are General Education (basic) Courses taken and passed prior to Academic Year 2018-2019 eligible for accreditation?,"No, General Education (basic) Courses taken and passed prior to Academic Year 2018-2019 are ineligible for accreditation except for Rizal and NSTP.",14
What are the requirements for international students from countries that are members of The Hague Conference on Private International Law (HCCH)?,The international students from countries that are members of The Hague Conference on Private International Law (HCCH) shall submit in English Form authenticated documents through the Apostille issued by the Secretary of State of the country of origin.,14
What are the requirements for international students from countries that are not members of HCCH?,"For students from countries not members of HCCH, what applies is an authentication with a red ribbon by the Philippine Embassy in the country of origin.",14
What are the requirements for graduates from schools abroad?,"For Graduates from Schools Abroad, they should bring the following requirements upon enrollment: Transcript of Records (1st and 2nd semesters of Grade 11 and Grade 12) for Bachelor’s Program (IGCSE/GCSE with A-Levels may also be considered), Diploma/Certificate of graduation Grade 12, Photocopy of Passport bio-page showing date and place of birth, English Proficiency Requirement with a rating in either IELTS with a score of 6.0 or TOEFEL with a score of at least 60 or as prescribed by the program.",14
What is the requirement for applicants who graduated from schools that used English as a medium of instruction?,Applicants who graduated from schools that used English as a medium of instruction are required to submit a certificate issued by the head of the institution or its legal representative.,14
What are the other requirements for international students?,"Birth Certificate/ Family Register / Household Register, Police Clearance (No Criminal Record) issued by the national police authorities in the student’s country of origin or legal residence, Original copy of notarized Affidavit of Support and proof of adequate financial support or bank statement to cover expenses for student’s accommodation and subsistence, school fees, and other incidental expenses, Five (5) copies of the Student’s Personal History Statement (PHS) duly signed in English and in his/her national language accompanied by his/her personal seal, if any.",14
What are the requirements for international students once officially enrolled?,"Once officially enrolled, the International Student must comply with the Bureau of Immigration requirements of the following: Student Visa Conversion (from tourist visa category to student visa), Student Visa Extension or Special Study Permit (SSP).",14
What are the requirements for international students graduating from senior high schools in the Philippines?,"For International Students Graduating from Senior High Schools in the Philippines, they should bring the following requirements upon enrollment: Report Card (Form 138) (1st and 2nd semester of Grade 12) duly certified/signed by the School Registrar/ Principal as eligible for college, Photocopy of Diploma, Birth Certificate / Household Register / Family Register duly authenticated, Photocopy of Passport bio-page showing date and place of birth, Copy of Special Study Permit (SSP) issued by the Bureau of Immigration or copy of other visas e.g. SSRV, SIRV, 9G etc.",14
What are the requirements for international student transferees from Philippine schools?,"For international student transferees from Philippine schools, they should bring the following requirements upon enrollment: Original copy of the Certificate of Transfer Credential (Honorable Dismissal), Transcript of Records (Informative Copy), Certificate of Good Moral Character / Clearance from OSA, Photocopy of Passport bio-page, Copy of 9F valid Student Visa Stamp, Copy of Alien Certificate of Registration of Identification Card (ACR-ICard), Birth Certificate / Family Register / Household Register duly authenticated, NBI clearance, Original copy of notarized Affidavit of Support and proof of adequate financial support or bank statement to cover expenses for student’s accommodation and subsistence, school fees, and other incidental expenses.",14
What are the requirements for transferees from schools abroad?,"For transferees from schools abroad, they should bring the following requirements upon enrollment: Transcript of Records, Certificate of Graduation/Diploma, Police clearance (No Criminal Record) issued by the national police authorities in the student’s country of origin or legal residence, Photocopy of Passport bio-page, English Proficiency Requirement with a rating in either IELTS with a score of 6.0 or TOEFEL with a score of at least 60 or as prescribed by the program.",14
What are the requirements for those with dual citizenship and graduated abroad?,"For those with dual citizenship and graduated abroad, they should bring the following requirements upon enrollment: Transcript of Records (Informative Copy), Certificate of Graduation/Diploma, Police Clearance (No Criminal Record)/ Certificate of Good Moral Character, Photocopy of Passport bio-page/Philippine Passport, Original Authenticated PSA (NSO) Birth Certificate, Clear photocopy of Birth Certificate, A valid Philippine Passport: Identification Certificate (IC) or Certificate of Reacquisition/Retention of Philippine Citizenship.",14
Where should the complete enrollment documentation be submitted?,"The complete enrollment documentation shall be submitted to the EXTERNAL RELATIONS AND INTERNATIONALIZATION OFFICE (ERIO), Downtown Campus personally or through a courier service addressed to: EXTERNAL RELATIONS AND INTERNATIONALIZATION OFFICE, University of San Carlos, P. Del Rosario St., Cebu City 6000, Philippines.",14
What happens if a student has been found to have submitted an intentional misrepresentation/misdeclaration or falsification of submitted documents?,The University may invalidate the enrollment of a student who has been found to have submitted an intentional misrepresentation/misdeclaration or falsification of submitted documents.,14
Who are cross-enrollees and consortium students?,Cross-enrollees and consortium students are non-USC students who intend to enroll in the University for a semester subject to the approval of the Department Chair and School Dean.,14
What should cross-enrollees and consortium students submit?,They should submit a Permit to Study / Cross-enrollment Permit issued by the Registrar of the home institution during the enrollment period.,14
Who are special students?,Special Students are students admitted to the University but are not entitled to receive official credit for a course because they do not satisfy the requirements for admission.,14
What should special students do during enrollment?,During enrollment they should: get written approval from the School Dean and/or Department Chair concerned; go to the Office of the University Registrar to execute the contract in which they waive the right to receive and demand credit for the work done; pay in full the required fees at the time of enrollment; have a Special Study Permit (for foreign students).,14
What should foreign nationals who intend to enroll as Special Students do?,Foreign nationals who intend to enroll as Special Students should get clearance from the External Relations and Internationalization Office.,14
What should Philippine-born alien students submit?,Philippine-born alien students are required to submit a photocopy of their Alien Certificate of Registration I-Card (ACR I-Card) and Native Born Certificate of Registration (NBCR) which are certified by the Commission on Higher Education (CHED).,14
What should foreign-born alien students submit?,Foreign-born alien students are required to submit a photocopy of their Alien Certificate of Registration (ACR) that is certified by CHED.,14
What should students whose parents are naturalized Filipinos submit?,"Students whose parents are naturalized Filipinos are required to submit a photocopy of the Identification Certificate issued by the Bureau of Immigration, which is certified against the original copy by CHED.",14
What is the next step after the application for admission is accepted by the Department Chair?,A student can now proceed to the enrollment with the following steps.,15
What is the first step in the enrollment process?,Submit the requirements personally or via courier to the Records Section of the Office of the University Registrar.,15
What happens once the requirements are received and verified by the Office of the University Registrar?,The applicant will now be tagged to the program applied for.,15
What will the applicant receive upon submission of the mandatory requirements?,A clearance slip which will be required for the issuance of the RFID (School ID) after enrollment.,15
What should the applicant check after being tagged to the program?,The inbox and/or spam folder of the email address specified/registered in the application form.,15
What will the applicant receive in the email?,An email indicating his/her acceptance in the University as well as the student ID number and a link in ISMIS where he/she can set his/her password.,15
What is the email address that the applicant will receive the email from?,The email address is the one he/she has specified in the application form.,15
How long is the link in the email valid for?,The link expires after 24 hours.,15
What should the applicant do if the link expires?,"To request for a new link, email irmoacs@usc.edu.ph.",15
What is the next step after receiving the email?,"Pay the down payment of Php 3,000.00 through the most convenient payment channels.",15
Where can the applicant access the payment channels?,Through the website https://www.usc.edu.ph/updated-payment-channels.,15
What should scholars do instead of paying the down payment?,"Request for the endorsement letter from the Office of Alumni Affairs, Scholarships and Job Placement (OAASJP) and the OAASJP will email it to assessmenttertiary@usc.edu.ph to bypass or override the down payment.",15
What should the applicant do if unable to enroll after 2 to 3 banking days of paying the down payment?,Send a proof of payment to offsitecol@usc.edu.ph.,15
What is the next step after paying the down payment?,Log in to the ISMIS portal with the website https://ismis.usc.edu.ph/ using the given username and the set password.,15
What should the applicant do in the ISMIS portal?,"Click ""Student Task"", ""Enrollment Related"", and ""Student Enrollment"" and proceed with either block enrollment or non-block enrollment depending on the period set during the day the enrollment module is accessed.",15
Who should the applicant contact for concerns in the ISMIS portal?,The department chair.,15
What is the next step after enrolling in the ISMIS portal?,"Print the study load by clicking ""Student Task"", ""Enrollment Related"", and ""View Study Load"" and click the Print button.",15
What is the final step in the enrollment process?,Proceed to the IRMO ID Room (either at the Downtown or Talamban Campus) for picture taking.,15
What is required to release the School ID?,The clearance from the Office of the University Registrar.,15
Who should the applicant contact for concerns in the IRMO ID Room?,Email irmoacs@usc.edu.ph.,15
What happens as soon as classes start?,Students are automatically enrolled in the CANVAS Learning Management System (LMS) to receive announcements and updates of the courses they are enrolled in as well as through the USC emails of the students.,15
What should the applicant do if there are no notifications received?,Email irmoacs@usc.edu.ph to request for an update.,15
When must an applicant student enroll?,During the prescribed registration period.,16
Where can detailed instructions on online enrollment procedures be found?,In ISMIS and the official USC website.,16
Is enrollment by proxy allowed?,"No, enrollment by proxy is not allowed.",16
Where is enrollment done?,In the ISMIS portal.,16
What is the link for the ISMIS portal?,https://ismis.usc.edu.ph.,16
What does ISMIS stand for?,Integrated School Management Information System.,16
Who can access the ISMIS portal?,"USC students, faculty, and staff.",16
What type of information can be found in ISMIS?,Pertinent school information.,16
What can officially enrolled students view in ISMIS?,"Grades, class schedules, application for student requests (withdrawal, program shift, overload, etc.), assessment and enrollment.",16
What is understood when a student registers in USC?,That he/she is enrolling for the entire term.,16
What are the requirements for a student to be officially enrolled?,"Submission of required documentation requirements at the Office of the University Registrar, initial payment of school fees, and issuance or download of a validated Study Load.",16
What is given to a student upon receipt of the required documents?,A clearance form for the USC ID card.,16
"What is required for a student to participate in class activities, take quizzes and major exams, and receive a grade at the end of the semester?",Official enrollment in a course.,16
What must be reflected on the class list?,The student's name.,16
What is a course?,"A subject offered in a tertiary institution, identified by the course title, course code, and course description.",16
What is a class list?,A list of students officially enrolled in a particular course and schedule.,16
Can a student change a program during the enrollment period?,"Yes, with the endorsement of the Department Chair and School Dean and approval by the Registrar.",16
Are changes permitted after the close of the enrollment period?,No.,16
Is cross-enrollment generally allowed?,"No, it is discouraged.",16
Under what circumstances may cross-enrollment be permitted?,"For valid reasons, as determined by the Department Chair and the approval of the School Dean, to graduating students (with a Deficiency Form) of not more than six (6) units during the semester and three (3) units during the summer term, inclusive of the total units enrolled in that particular term.",16
Is cross-enrollment allowed if it is the only remaining course?,No.,16
Why is cross-enrollment not allowed if it is the only remaining course?,So as not to prejudice the student’s residency in the University.,16
What must be taken at the University?,The last course.,16
Under what circumstances may a permit to study in another school be granted?,"Upon the recommendation of the Department Chair and the approval of the School Dean, but only for general education courses.",16
What courses must be taken at the University?,"Major, professional, or technical courses required for the degree program pursued.",16
Is withdrawal of courses allowed even after the close of the enrollment period?,"Yes, with the endorsement of the Department Chair and School Dean.",16
Where can the Application for withdrawal of course(s) be found?,Online in ISMIS under Student Task.,16
Until when is withdrawal of course(s) allowed?,Until mid-term examinations or after the incurrence of unexcused absences (20% of the total number of required school days).,16
What are the corresponding charges for withdrawal?,Stipulated in Section 3.6.,16
What must a student apply for online in ISMIS if they intend to transfer to another school?,A Certificate of Transfer Credentials (CTC).,16
What will be issued to the applicant after being cleared of all financial and property liabilities?,A Certificate of Transfer Credentials (CTC) with the informative copy of the Transcript of Records and other documents.,16
