Question,Answer,Topic
What is the role of the academic chairperson in the disciplinary process?,The academic chairperson approves the recommendations of the SDMs.,49
What is the role of the academic dean in the disciplinary process?,The academic dean approves the recommendations of the SDEVCOM.,49
What is the role of the OSFA in the disciplinary process?,The head of the OSFA is a member of the Student Discipline Committee.,49
What is the role of the university lawyer in the disciplinary process?,The university lawyer is a member of the Student Discipline Committee.,49
What is the role of the student development board in the disciplinary process?,A member of the student development board is a member of the Student Discipline Committee.,49
What is a minor offense?,"Minor violations do not involve serious injury or harm, lack evidence of malice or premeditation, behaviors can be attributed to development or circumstances, and have little or no serious negative implications for the University or its members.",50
What happens to minor offenses in a student's record?,"Minor offenses are recorded in a student’s name, but do not prevent him/her from receiving a clean Certificate of Good Moral Character.",50
How often is the frequency of minor offenses refreshed?,The frequency of offense is refreshed every semester.,50
What happens if a student commits repeated minor violations in a semester?,"Repeated minor violations in a semester, however, may constitute a basis for the filing of a higher rank offense.",50
How many warnings are given for minor offenses?,Minor offenses are given three (3) warnings.,50
What is the first warning for a minor offense?,"First warning constitutes a Discipline Consultative Session (in accordance with our ""Sultihi ako, maminaw ako"" Program-Consultative Session/s).",50
What is the second warning for a minor offense?,"Second warning, the Student is now required to submit an apology letter before his/her school ID is returned.",50
What is the third warning for a minor offense?,Third warning serves as the Final Warning.,50
Who can call the attention of a student who committed a minor offense?,"All teachers, school officials, and other university employees and persons in authority may call the attention of the student who committed a minor offense.",50
Who handles minor offenses?,"Depending on the frequency and the school of the student(s) involved, minor offenses are handled by the Student Development Mentors (SDMs) and by the Student Development Committee (SDEVCOM) members.",50
What is the procedure for the first offense of a minor offense?,First offense - Discipline Conversation (Oral Warning).,50
What is the procedure for the second offense of a minor offense?,Second Offense - Discipline Conversation (Written Warning is given after which the student is required to make a written reply.).,50
What is the procedure for the third offense of a minor offense?,Third Offense - Discipline Conversation. See other disciplinary support & consequences. (Written Reply).,50
What is a less serious offense?,Less serious offenses are acts that disrupt the order and are a threat to the security and safety of the school.,50
What is the impact of less serious offenses on a student's record?,Less serious offenses are recorded in a student’s name but do not prevent them from receiving a clean Certificate of Good Moral Character.,50
How often is the frequency of less serious offenses refreshed?,"Although still recorded, the frequency of offense is refreshed every academic year.",50
What happens if a student commits repeated less serious offenses in an academic year?,"Repeated less serious offenses in an academic year, however, may constitute a basis for the filing of a higher rank offense.",50
Who can call the attention of a student who committed a less serious offense?,"All teachers, school officials, and other university employees and persons in authority may call the attention of the student who committed a less serious offense.",50
Who handles less serious offenses?,"Depending on the frequency and the school of the student(s) involved, less serious offenses are handled by the Student Development Mentors (SDMs) and by the Student Development Committee (SDEVCOM) members.",50
What is the procedure for the first offense of a less serious offense?,First offense - Discipline Conversation. Written Warning is given to the student and required to submit a written reply.,50
What is the procedure for the second offense of a less serious offense?,Second offense - Written Warning is given to the student and required to submit a written reply.,50
What is the procedure for the third offense of a less serious offense?,Third offense - Written Warning is given to the student and required to submit a written reply.,50
What is a serious offense?,"Serious offenses are acts that do a greater threat or damage to the safety, property, honor, and dignity of another person and the school.",50
What is the impact of serious offenses on a student's record?,Serious offenses are recorded in a student’s name during his/her stay in the University and may prevent him/her from receiving a clean Certificate of Good Moral Character.,50
Who can call the attention of a student who committed a serious offense?,"All teachers, school officials, and other university employees and persons in authority may call the attention of the student who committed a serious offense.",50
Who handles serious offenses?,Serious offenses are handled by the campus student discipline office (SDO).,50
What is the procedure for serious offenses?,"For all offenses: Discipline Conversation (Written Reply). The chair, the dean, and the Parents/Guardians are informed. The Student Discipline Committee convened. See other disciplinary support & consequences. Written Warning is given to the student and required to submit a written reply.",50
What is a very serious offense?,"Very serious offenses are acts that do the greatest threat or damage to the safety, property, honor, and dignity of another person and the school.",50
What is the impact of very serious offenses on a student's record?,Very Serious offenses are recorded in a student’s name during his/her stay in the University and may prevent him/her from receiving a Certificate of Good Moral Character.,50
What is the procedure for very serious offenses?,"Step 1: The Chair of the Student Discipline Board (SDB) receives the case documents from the SDMC. Step 2: The Chair of the SDB furnishes copies of the case documents within 5 working days upon receipt thereof to all members of the committee for them to review, assess and study. Step 3: The SDB Chair convenes the members not more than 5 working days after furnishing copies of the case documents to the members of the SDB. Step 4: The SDB evaluates, assesses and reviews the findings of the case. Step 5: The SDB makes the final decision/judgement of the case. Step 6: The decision of the SDB shall become final and executory after 5 working days after the SDB has been convened. Step 7: The Student Discipline Officer facilitates the enforcement of the final decision.",50
What is the composition of the Student Discipline Board (SDB)?,"Composition of the Student Discipline Board (SDB) is as follows: Director of Student Services Chair, Student Discipline Officer – Secretariat, Student Discipline Mentor of the Complainant, Student Discipline Mentor of the Respondent, Legal Consultant, if needed.",50
What happens if the complainant is not satisfied with the decision?,"In cases where the complainant/s is not satisfied with the decision, he/ she may file a written appeal to the Vice President for Academic Affairs.",50
What is the final decision of the Vice President for Academic Affairs?,The decision of the VPAA is no longer appealable.,50
What happens to the written document with all the attachments?,"The Chair, Dean, and Parents/Guardians are informed. The Student Discipline Committee is convened, after which a written document with all the attachments are kept in the SDO for proper filing with the utmost confidentiality.",50
What is the University's right to act on the condemnable act or omission of a student not limited to?,What is listed or mentioned in this list of offenses.,51
What is actionable in a court or quasi-judicial body also actionable in the administrative tribunal of the University?,Whatever is actionable in a court or quasi-judicial body.,51
What happens if there is no written complaint?,"The Administration, on its initiative, will be the complainant and start the investigative proceedings.",51
What is the ranking of the offense of failure to wear the prescribed school uniform or dress code according to the specification and standards set by the University?,A – Light offense.,51
What is the ranking of the offense of untidy appearance and/or inappropriate attire for a school environment?,A – Light offense.,51
What is the ranking of the offense of wearing attire/school uniform according to their gender preference without approval/clearance from the Gender Development Officer at OSFA?,B/C.,51
"What is the ranking of the offense of coming to school in a civilian attire, when allowed, that does not promote a dignified, decent and formal appearance, and decorum?",B/C.,51
What is the ranking of the offense of failure to present a uniform exemption?,A/B.,51
What is the ranking of the offense of taking off the school uniform on campus except during class activities that require decent and formal attire?,A/B.,51
What is the ranking of the offense of wearing/moving around the campus in a PE uniform but outside of PE classes?,A/B.,51
What is the ranking of the offense of coming to school with unkept or untidy haircut/hairstyle?,A/B.,51
What is the ranking of the offense of exposure of body tattoos with offensive and obscene designs?,A/B.,51
What is the ranking of the offense of entering the University campus without a valid school identification card (ID) such as tailgating?,A/B.,51
What is the ranking of the offense of non-wearing of school identification card on campus?,A.,51
What is the ranking of the offense of use of two or more school ID or gate pass by whatever means or manner?,A/B.,51
"What is the ranking of the offense of representing, wearing or using any uniform, insignia or other identifying marks of the University or any department or college without authorization for personal gain?",B/C.,51
What is the ranking of the offense of unauthorized access of computer files like hacking and other IT-related violations?,B/C/D.,51
"What is the ranking of the offense of unauthorized collection of money, checks, or any other instrumentality of monetary value and/or embezzlement of funds?",B/C/D.,51
What is the ranking of the offense of entering the campus or off-campus sites under the influence of alcohol and prohibited substances?,C/D.,51
What is the ranking of the offense of bringing of intoxicated beverage in whatever quantity on campus?,C/D.,51
What is the ranking of the offense of engaging in an unrestrained drinking of alcoholic beverages with schoolmates or friends in school uniform outside the campus?,C/D.,51
"What is the ranking of the offense of possession of firearm, air gun, or similar gun replicas, sharp-bladed weapons, tear gas, firecrackers, pyrotechnics, explosive or miniature bombs inside the campus?",D.,51
What is the ranking of the offense of threatening to use these weapons to harm anybody inside the campus?,C/D.,51
What is the ranking of the offense of hazing as defined in RA No. 11053 or the Anti Hazing Law?,D.,51
What is the ranking of the offense of violation of parking regulations?,A.,51
What is the ranking of the offense of engaging in endangering behavior?,A/B/C/D.,51
"What is the ranking of the offense of indiscriminate throwing of waste paper, candy wrappers, chewing gums, plastic cups, etc. on campus or spitting on floors or walls?",A.,51
"What is the ranking of the offense of loitering or making excessive noise in corridors, stairways, or immediate vicinities during classes?",A.,51
"What is the ranking of the offense of loud and disturbing arguments, shouting, or heckling that are offensive to the sensibilities of the school community?",A/B.,51
"What is the ranking of the offense of unauthorized use of cellular phones, iPods, or other communication gadgets inside the classroom?",A/B/C/D.,51
What is the ranking of the offense of bringing in or playing with any gambling paraphernalia and engaging in gambling activities inside the campus?,A/B.,51
What is the ranking of the offense of smoking/vaping inside the campus and its immediate vicinity?,B.,51
"What is the ranking of the offense of deliberate disruption of classes, academic functions, or activities within University premises?",A/B/C.,51
"What is the ranking of the offense of brawls, riots, hooliganism on or off campus?",B/C/D.,51
"What is the ranking of the offense of instigating or participating in group activities, gatherings, rallies, and the like that result in stoppage or disruption of classes and/or other academic activities?",C/D.,51
What is the ranking of the offense of causing panic or confusion that leads to the disruption of classes and other academic activities?,C/D.,51
"What is the ranking of the offense of unauthorized rallies, barricading, picketing, preventing, or threatening any student from entering the school campus or attending classes, and/or school personnel from discharging their duties?",C/D.,51
What is the ranking of the offense of initiating or participating in activities contrary to law or public order?,D.,51
"What is the ranking of the offense of subverting or defying policies and guidelines of any college department, office of the University, and CHED?",C/D.,51
What is the ranking of the offense of any act or omission punishable under the rules and regulations of the University or laws of the land?,C/D.,51
What is required to enroll every semester or to leave the University at any time?,Satisfaction of pending academic and non-academic obligations.,52
What is the purpose of clearance?,To enroll every semester or to leave the University at any time.,52
What kind of obligations must be satisfied for clearance?,Pending academic and non-academic obligations.,52
What happens to students who have not resolved their disciplinary cases?,"They will not be allowed to proceed with enrollment, transfer, or graduation.",52
What happens to students who have inadequately followed the recommendation of support and sanctions?,"They will not be allowed to proceed with enrollment, transfer, or graduation.",52
Who must sign off on the clearance?,The Student Development Mentor and the campus Student Discipline Officer.,52
What is part of the requirement for clearance?,The signature of the Student Development Mentor and the campus Student Discipline Officer.,52
Why is clearance necessary?,To ensure satisfaction of pending academic and non-academic obligations.,52
What is the consequence of not resolving disciplinary cases?,"Not being allowed to proceed with enrollment, transfer, or graduation.",52
What is the consequence of not following the recommendation of support and sanctions?,"Not being allowed to proceed with enrollment, transfer, or graduation.",52
Who is responsible for ensuring clearance?,The Student Development Mentor and the campus Student Discipline Officer.,52
What is the role of the Student Development Mentor in clearance?,To sign off on the clearance.,52
What is the role of the campus Student Discipline Officer in clearance?,To sign off on the clearance.,52
What is the purpose of the signature of the Student Development Mentor and the campus Student Discipline Officer?,To ensure clearance.,52
"What is the requirement for enrollment, transfer, or graduation?",Clearance.,52
What is the definition of clearance?,Satisfaction of pending academic and non-academic obligations.,52
What is the scope of clearance?,Every semester or to leave the University at any time.,52
What is the benefit of clearance?,To enroll every semester or to leave the University at any time.,52
What is the consequence of not having clearance?,"Not being allowed to proceed with enrollment, transfer, or graduation.",52
What is the responsibility of the student in clearance?,To satisfy pending academic and non-academic obligations.,52
What is the role of the university in clearance?,To ensure satisfaction of pending academic and non-academic obligations.,52
What is the purpose of the clearance process?,To ensure satisfaction of pending academic and non-academic obligations.,52
What is the outcome of the clearance process?,To enroll every semester or to leave the University at any time.,52
What is the requirement for students who have disciplinary cases?,To resolve their disciplinary cases.,52
What is the requirement for students who have not followed the recommendation of support and sanctions?,To adequately follow the recommendation of support and sanctions.,52
What is the consequence of not resolving disciplinary cases?,"Not being allowed to proceed with enrollment, transfer, or graduation.",52
What is the consequence of not following the recommendation of support and sanctions?,"Not being allowed to proceed with enrollment, transfer, or graduation.",52
What is the topic of the guidelines discussed in the manual?,Guidelines for Ensuring Discipline and Due Process,53
What type of offenses do the guidelines cover in the first section?,Minor offenses and less serious offenses,53
Who does the complainant submit a letter of complaint/incident report to in minor offenses?,Student Discipline Mentor (SDM),53
How many days does the student respondent have to answer the complaint filed against him/her?,3 days,53
What happens in Step 3 of the guidelines for minor offenses?,The SDMs of the complainant and respondent assess the gravity of the offense and call the student respondent for a discipline conversation.,53
Who may be invited to the discipline conversation in Step 3?,Some witnesses,53
What do the two SDMs do after determining the gravity of the offense?,Recommend interventions and sanctions to be endorsed by the campus Student Discipline Officer (SDO) and approved by the Head of the Office Student Formation and Activities.,53
What happens in Step 5 of the guidelines for minor offenses?,"If the case is resolved within the level of the SDMs, the student respondent signs an agreement wherein it is stated that he/she promises not to commit any infraction again.",53
What happens if the case cannot be resolved at the level of the SDMs?,It is elevated to the Student Discipline Mentors Committee (SDMC).,53
How many days do the SDMs have to forward the case documents to the SDMC?,Not more than 5 days,53
What type of offenses do the guidelines cover in the second section?,Serious offenses and very serious offenses,53
Who does the complainant submit a letter of complaint/incident report to in serious offenses?,Campus Student Discipline Officer (SDO),53
How many days does the student respondent have to answer the complaint filed against him/her in serious offenses?,3 days,53
What happens in Step 3 of the guidelines for serious offenses?,The SDO informs the members of the SDMC of the date set for the case conference.,53
How many working days does the SDO have to schedule the case conference?,Not more than 10 working days,53
What happens during the case conference in Step 4 of the guidelines for serious offenses?,The SDMC calls the student complainant and respondent for a case conference.,53
Who may be invited to the case conference in Step 4?,Some witnesses,53
What standards of due process must be satisfied during the case conference?,The respondent should have been informed in writing of the nature and cause of the accusation/s; The respondent should have been granted the right to answer the charges against her/him; The respondent should be informed of the evidences against him/her; The respondent is given the right to adduce evidence on his/ her own behalf; and the evidence should be considered by the SDMC.,53
What happens in Step 5 of the guidelines for serious offenses?,The SDMC after having determined the gravity of the offense committed may recommend the intervention and sanctions to be endorsed by the Head of the Office of Student Formation and Activities.,53
Who enforces the approved intervention and sanctions in Step 6?,The SDO,53
Who receives copies of the approved intervention and sanctions?,Both the complainant and respondent,53
What happens if the case cannot be resolved at the level of the SDMC?,It is elevated to the Student Discipline Board (SDB).,53
How many days do the SDMC have to forward the case documents to the SDB?,Not more than 5 days,53
Who are the members of the Student Discipline Mentors Committee (SDMC)?,"Chair of Student Discipline Officer, Student Discipline Mentor of the Complainant, Student Discipline Mentor of the Respondent, Student Representative of the Collegiate Council of the Complainant, Student Representative of the Collegiate Council of the Respondent, and Head of Office of Student Formation and Activities.",53
Who will be permitted to continue with their studies?,Pregnant students,54
Under what condition will pregnant students be permitted to continue with their studies?,On the condition that their enrollment in the university will not pose health and safety risks given their health condition.,54
Why may the school require the student concerned to present medical clearance?,For the purpose.,54
What may the school require the student concerned to present?,Medical clearance and such other documents as may be rendered necessary.,54
What is the purpose of requiring the student concerned to present medical clearance and other documents?,For the purpose.,54
Who may be required to present medical clearance and other documents?,The student concerned.,54
What is the policy for pregnant women in the university?,Pregnant students will be permitted to continue with their studies on the condition that their enrollment in the university will not pose health and safety risks given their health condition.,54
What is the consideration for permitting pregnant students to continue with their studies?,That their enrollment in the university will not pose health and safety risks given their health condition.,54
What may be required from pregnant students to continue with their studies?,Medical clearance and such other documents as may be rendered necessary.,54
Why may the school require documents from pregnant students?,To ensure that their enrollment in the university will not pose health and safety risks given their health condition.,54
What is the purpose of the policy for pregnant women?,To ensure that pregnant students can continue with their studies safely.,54
Who does the policy for pregnant women apply to?,Pregnant students.,54
What is the condition for pregnant students to continue with their studies?,That their enrollment in the university will not pose health and safety risks given their health condition.,54
What may the school do if a pregnant student's enrollment poses health and safety risks?,Not specified in the context.,54
Can pregnant students continue with their studies without any conditions?,"No, they need to meet the condition that their enrollment in the university will not pose health and safety risks given their health condition.",54
What is the role of the school in ensuring pregnant students' safety?,The school may require the student concerned to present medical clearance and such other documents as may be rendered necessary.,54
What documents may be required from pregnant students?,Medical clearance and such other documents as may be rendered necessary.,54
Why is medical clearance required from pregnant students?,For the purpose.,54
What is the purpose of requiring medical clearance from pregnant students?,For the purpose.,54
Who will determine if a pregnant student's enrollment poses health and safety risks?,Not specified in the context.,54
What happens if a pregnant student's enrollment poses health and safety risks?,Not specified in the context.,54
Can pregnant students continue with their studies without presenting medical clearance?,"No, the school may require the student concerned to present medical clearance.",54
What is the policy title?,Policy for Pregnant Women.,54
What is the topic number of the policy?,Topic 54.,54
What is the page content of the policy?,Topic 54: Policy for Pregnant Women.,54
Who has jurisdiction over all cases involving the discipline of students?,"The USC Administration, through the Office of Student Formation and Activities – Student Discipline Section.",55
What happens if a student refuses to heed the summons to appear before the investigating body set up by the administration?,"A student who is charged with an offense, and refuses to heed the summons to appear before the investigating body set up by the administration is deemed to have waived his/her right to present evidence/s.",55
What will be the basis of the decision if a student refuses to appear before the investigating body?,The case shall then be decided based on the complaint and the evidence presented.,55
Is misconduct committed outside the University covered by the policy on discipline?,"Yes, misconduct committed outside the University, consequently affecting his/her status as a student, is covered with the policy on discipline.",55
What happens if a student who committed misconduct outside the University enrolls again?,"In case of subsequent enrollment of such a student, he/she will have to answer the charges filed and lodged against him/her.",55
Who sets up the investigating body?,The administration sets up the investigating body.,55
